{"$schema":"https://json-schema.org/draft/2020-12/schema","$id":"preview-powerpoint-build-report.schema.json","type":"object","additionalProperties":false,"required":["schema_version","artifact_type","deck_id","slide_id","element_map_sha256","compatibility_report_sha256","layout_sha256","asset_manifest_sha256","preview_pptx_sha256","preview_only","delivery_forbidden","powerpoint_render_required","status"],"properties":{"schema_version":{"const":"1.0"},"artifact_type":{"const":"preview_powerpoint_build_report"},"deck_id":{"type":"string","minLength":1},"slide_id":{"type":"string","minLength":1},"element_map_sha256":{"type":"string","pattern":"^[a-f0-9]{64}$"},"compatibility_report_sha256":{"type":"string","pattern":"^[a-f0-9]{64}$"},"layout_sha256":{"type":"string","pattern":"^[a-f0-9]{64}$"},"asset_manifest_sha256":{"type":"string","pattern":"^[a-f0-9]{64}$"},"preview_pptx_sha256":{"type":"string","pattern":"^[a-f0-9]{64}$"},"preview_only":{"const":true},"delivery_forbidden":{"const":true},"powerpoint_render_required":{"const":true},"status":{"const":"built"}}}
