{
  "schema_version": "1.0",
  "artifact_type": "preview_powerpoint_build_report",
  "deck_id": "D03",
  "slide_id": "S02",
  "element_map_sha256": "a3c6a4d12c57dfd276484a590b92d0dac7a30dba003a96438ee3ad6685454d98",
  "compatibility_report_sha256": "ba8eb525633520766d6bd4813f0344d22b65b8c1a6d5835df2f09ccd65152477",
  "layout_sha256": "423456ea37dd178cc49c4f2bee8a6f466e1b5034a33e9095917a2e32988206f2",
  "asset_manifest_sha256": "7fb8a67b286b0c427e3b2d88f9e9e988160c4bb6b32b3ec9921848cc9bc1c7e5",
  "preview_pptx_sha256": "11f8d25c1ffed7517253718f51f5b4322c6699c44cb2ccae3ff06eabfbba8ee8",
  "preview_only": true,
  "delivery_forbidden": true,
  "powerpoint_render_required": true,
  "status": "built"
}
