{
  "schema_version": "1.0",
  "artifact_type": "preview_powerpoint_build_report",
  "deck_id": "D03",
  "slide_id": "S03",
  "element_map_sha256": "a61f25368d6d279c14866142bb6904cc38c3a917122cc0d9b64ac3a37177eca1",
  "compatibility_report_sha256": "b2f7983bbb8bf77901e69b6b8d85b3071bf248eb769b78340c5fa2fa78a74ec7",
  "layout_sha256": "dcbec0bbe695d65781b767c235199411e7bd118eb9de35e814f9801cd2bfd5c1",
  "asset_manifest_sha256": "19b6b053d09fb1f2a71b4679f290ae70c611b968ef3c67488a278c5db9b11539",
  "preview_pptx_sha256": "b7a2cfabd13f756569c1d222462b4d3479e1e50891f1e055c0bd6a97b951a309",
  "preview_only": true,
  "delivery_forbidden": true,
  "powerpoint_render_required": true,
  "status": "built"
}
